<?xml version="1.0" encoding="UTF-8" ?>
<service xsi:noNamespaceSchemaLocation="../core/sedola.xsd" xmlns:xsi="http://www.w3.org/2001/XMLSchema-instance">
    <title>Home Documents</title>
    <documentation source="http://tools.ietf.org/html/draft-nottingham-json-home">This document proposes a "home document" format for non-browser HTTP clients.</documentation>
    <documentation source="http://tools.ietf.org/html/draft-wilde-home-xml">The current draft for HTTP Home Documents provides a JSON syntax only. This draft provides an XML syntax for the same underlying data model, so that the concept of HTTP Home Documents can be consistently exposed in both JSON- and XML-based HTTP services.</documentation>
    <mediatype xml:id="home-document-json" type="application/home+json">
        <document xml:id="home-document-document-json">
            <title>Home Documents (JSON)</title>
            <documentation source="http://tools.ietf.org/html/draft-nottingham-json-home">This document proposes a "home document" format for non-browser HTTP clients.</documentation>
        </document>
    </mediatype>
    <mediatype xml:id="home-document-xml" type="application/home+xml">
        <document xml:id="home-document-document-xml">
            <title>Home Documents (XML)</title>
            <documentation source="http://tools.ietf.org/html/draft-wilde-home-xml">The current draft for HTTP Home Documents provides a JSON syntax only. This draft provides an XML syntax for the same underlying data model, so that the concept of HTTP Home Documents can be consistently exposed in both JSON- and XML-based HTTP services.</documentation>
        </document>
    </mediatype>
    <vocabulary xml:id="home-document-json-vocabulary">
        <title>The Home Document JSON Vocabulary</title>
        <documentation source="http://tools.ietf.org/html/draft-nottingham-json-home-03#section-2">A JSON Home Document uses the format described in RFC 4627 and has the media type "application/json-home". Its content consists of a root object with a "resources" property, whose member names are link relation types (as defined by RFC 5988), and values are Resource Objects, defined below.</documentation>
    </vocabulary>
    <vocabulary xml:id="home-document-xml-vocabulary">
        <title>The Home Document XML Vocabulary</title>
        <documentation source="http://tools.ietf.org/html/draft-wilde-home-xml-02#section-3">The following XML Schema is describing the XML shown in Section 2. Since there currently is no extension model, the XML Schema does currently not contain any extension points.</documentation>
    </vocabulary>
</service>