<?xml version="1.0" encoding="UTF-8" ?>
<service xsi:noNamespaceSchemaLocation="../../core/sedola.xsd" xmlns:xsi="http://www.w3.org/2001/XMLSchema-instance">
    <title short="XML">XML Media Types</title>
    <documentation source="http://tools.ietf.org/html/rfc3023">This document standardizes five new media types - text/xml, application/xml, text/xml-external-parsed-entity, application/xml-external-parsed-entity, and application/xml-dtd - for use in exchanging network entities that are related to the Extensible Markup Language (XML). This document also standardizes a convention (using the suffix '+xml') for naming media types outside of these five types when those media types represent XML MIME (Multipurpose Internet Mail Extensions) entities. XML MIME entities are currently exchanged via the HyperText Transfer Protocol on the World Wide Web, are an integral part of the WebDAV protocol for remote web authoring, and are expected to have utility in many domains.</documentation>
    <mediatype def="text/xml">
        <documentation source="http://tools.ietf.org/html/rfc3023#section-3.1">If an XML document - that is, the unprocessed, source XML document - is readable by casual users, text/xml is preferable to application/xml. MIME user agents (and web user agents) that do not have explicit support for text/xml will treat it as text/plain, for example, by displaying the XML MIME entity as plain text.</documentation>
    </mediatype>
    <mediatype def="application/xml">
        <documentation source="http://tools.ietf.org/html/rfc3023#section-3.2">Application/xml is preferable when an XML document is unreadable by casual users.</documentation>
    </mediatype>
    <mediatype def="text/xml-external-parsed-entity">
        <documentation source="http://tools.ietf.org/html/rfc3023#section-3.3">If an XML external parsed entity - that is, the unprocessed, source XML entity - is readable by casual users, text/xml-external-parsed-entity is preferable to application/xml-external-parsed-entity. MIME user agents (and web user agents) that do not have explicit support for text/xml-external-parsed-entity will treat it as text/plain, for example, by displaying the XML MIME entity as plain text.</documentation>
    </mediatype>
    <mediatype def="application/xml-external-parsed-entity">
        <documentation source="http://tools.ietf.org/html/rfc3023#section-3.4">Application/xml is preferable when an XML external parsed entity is unreadable by casual users.</documentation>
    </mediatype>
    <mediatype def="application/xml-dtd">
        <documentation source="http://tools.ietf.org/html/rfc3023#section-3.5">The media type application/xml-dtd SHOULD be used for "external DTD subsets" or "external parameter entities".</documentation>
    </mediatype>
</service>