<?xml version="1.0" encoding="UTF-8" ?>
<service xsi:noNamespaceSchemaLocation="../../core/sedola.xsd" xmlns:xsi="http://www.w3.org/2001/XMLSchema-instance">
    <title>Link Relation Types for Simple Version Navigation between Web Resources</title>
    <documentation source="http://tools.ietf.org/html/rfc5829">This specification defines a set of link relation types that may be used on Web resources for navigation between a resource and other resources related to version control, such as past versions and working copies.</documentation>
    <link xml:id="rfc6573-linkrel-version-history" rel="version-history">
        <documentation source="http://tools.ietf.org/html/rfc5829#section-3.1">When included on a versioned resource, this link points to a resource containing the version history for this resource.</documentation>
    </link>
    <link xml:id="rfc6573-linkrel-latest-version" rel="latest-version">
        <documentation source="http://tools.ietf.org/html/rfc5829#section-3.2">When included on a versioned resource, this link points to a resource containing the latest (e.g., current) version.</documentation>
    </link>
    <link xml:id="rfc6573-linkrel-working-copy" rel="working-copy">
        <documentation source="http://tools.ietf.org/html/rfc5829#section-3.3">When included on a versioned resource, this link points to a working copy for this resource.</documentation>
    </link>
    <link xml:id="rfc6573-linkrel-working-copy-of" rel="working-copy-of">
        <documentation source="http://tools.ietf.org/html/rfc5829#section-3.4">When included on a working copy, this link points to the versioned resource from which this working copy was obtained.</documentation>
    </link>
    <link xml:id="rfc6573-linkrel-predecessor-version" rel="predecessor-version">
        <documentation source="http://tools.ietf.org/html/rfc5829#section-3.5">When included on a versioned resource, this link points to a resource containing the predecessor version in the version history.</documentation>
    </link>
    <link xml:id="rfc6573-linkrel-successor-version" rel="successor-version">
        <documentation source="http://tools.ietf.org/html/rfc5829#section-3.6">When included on a versioned resource, this link points to a resource containing the successor version in the version history.</documentation>
    </link>
</service>